{
  "$schema": "https://json-schema.org/draft/2020-12/schema",
  "$id": "https://batvault.dev/schemas/decision.json",
  "title": "Decision (node)",
  "type": "object",
  "additionalProperties": false,
  "properties": {
    "id": {
      "type": "string",
      "minLength": 1,
      "maxLength": 256
    },
    "type": {
      "const": "DECISION"
    },
    "title": {
      "type": "string",
      "minLength": 1,
      "maxLength": 512
    },
    "description": {
      "type": "string",
      "minLength": 1,
      "maxLength": 4000
    },
    "decision_maker": {
      "type": "object",
      "additionalProperties": false,
      "properties": {
        "id":   { "type": "string", "minLength": 1, "maxLength": 256 },
        "name": { "type": "string", "minLength": 1, "maxLength": 256 },
        "role": { "type": "string", "minLength": 1, "maxLength": 128 },
        "org":  { "type": "string", "minLength": 1, "maxLength": 128 }
      },
      "required": ["id", "role"]
    },
    "domain": { "$ref": "./domain.json" },
    "timestamp": {
      "type": "string",
      "pattern": "^\\d{4}-\\d{2}-\\d{2}T\\d{2}:\\d{2}:\\d{2}Z$"
    },
    "sensitivity": {
      "type": "string",
      "enum": ["low","medium","high"]
    },
    "x-extra": { "type": "object" }
  },
  "required": ["id", "type", "title", "decision_maker", "domain", "timestamp"]
}